"website_name","url","country","region","category","contact_email","contact_page","reason_to_link","outreach_angle","quality_score_1_10","priority","status","contact_date","follow_up_date","response","link_acquired","anchor_text","target_page","notes"
"StartupBlink","https://www.startupblink.com/","Global","Global","startup directory","","https://www.startupblink.com/contact","Startup ecosystem directory may reference regional resources.","Submit only if there is a legitimate resource listing path.","6","medium","not contacted","","","","no","Somalia startup career resources","https://somkenjobs.com/career-resources","Avoid paid directory offers."
"Disrupt Africa","https://disrupt-africa.com/","South Africa","Africa","media","","https://disrupt-africa.com/contact/","African tech/business readers may value Somalia/Kenya hiring insights.","Pitch data story after publishing hiring report.","7","medium","not contacted","","","","no","East Africa hiring report","https://somkenjobs.com/career-resources","Media outreach only with data."
"TechCabal","https://techcabal.com/","Nigeria","Africa","media","","https://techcabal.com/contact/","African tech audience may cover East Africa startup/career trends.","Pitch data-led story, not a generic backlink.","7","medium","not contacted","","","","no","East Africa jobs data","https://somkenjobs.com/career-resources","Use media template."
"TechMoran","https://techmoran.com/","Kenya","East Africa","media","","https://techmoran.com/contact-us/","Kenya tech/business readers align with opportunity resources.","Pitch startup and youth employment resource.","7","medium","not contacted","","","","no","Kenya career resources","https://somkenjobs.com/career-resources","Media template."
"CIO Africa","https://cioafrica.co/","Kenya","Africa","media","","https://cioafrica.co/contact-us/","Technology leadership audience may value talent trend data.","Pitch East Africa hiring trends report.","7","medium","not contacted","","","","no","East Africa hiring report","https://somkenjobs.com/career-resources","Best after publishing data."
"WeeTracker","https://weetracker.com/","Kenya","Africa","media","","https://weetracker.com/contact-us/","African startup/business audience may cover jobs and ecosystem growth.","Pitch data/resource story.","6","medium","not contacted","","","","no","East Africa jobs resource","https://somkenjobs.com/career-resources","Verify activity before outreach."
"AfricArena","https://www.africarena.com/","South Africa","Africa","startup platform","","https://www.africarena.com/contact","African startup ecosystem may value talent resources.","Offer startup hiring resource for East Africa founders.","6","medium","not contacted","","","","no","Startup jobs resource","https://somkenjobs.com/jobs","Resource fit depends on content."
"Baobab Network","https://thebaobabnetwork.com/","Kenya","Africa","startup investor","","https://thebaobabnetwork.com/contact","Startup founders may need hiring and talent resources.","Share employer/talent guide for startups.","6","medium","not contacted","","","","no","East Africa startup jobs","https://somkenjobs.com/jobs","Partnership angle."
"Nation Africa","https://nation.africa/kenya","Kenya","East Africa","media","","https://nation.africa/kenya/contact-us-330232","Large audience; useful only for data-driven employment story.","Pitch job market data/report, not resource-page link.","7","medium","not contacted","","","","no","East Africa hiring report","https://somkenjobs.com/career-resources","High bar for editorial relevance."
"Business Daily Africa","https://www.businessdailyafrica.com/","Kenya","East Africa","media","","https://www.businessdailyafrica.com/bd/page/contact-us-2048368","Business readers align with labor market and employer trend content.","Pitch data-backed article idea.","7","medium","not contacted","","","","no","East Africa hiring report","https://somkenjobs.com/career-resources","Only after publishing report."
"The Standard Kenya","https://www.standardmedia.co.ke/","Kenya","East Africa","media","","https://www.standardmedia.co.ke/contact-us","Broad Kenyan audience; potential for youth/jobs resources.","Pitch career guide or job scam safety guide.","6","medium","not contacted","","","","no","Kenya career resources","https://somkenjobs.com/career-resources","Use focused story."
"The Star Kenya","https://www.the-star.co.ke/","Kenya","East Africa","media","","https://www.the-star.co.ke/contact-us","Broad news audience; useful for employment data stories.","Pitch monthly hiring trends or job scam guide.","6","medium","not contacted","","","","no","Kenya job safety guide","https://somkenjobs.com/career-resources","Media template."
"Capital FM Kenya","https://www.capitalfm.co.ke/","Kenya","East Africa","media","","https://www.capitalfm.co.ke/contact-us/","Business and lifestyle readers may value career resources.","Pitch graduate career guide or job scam guide.","6","medium","not contacted","","","","no","Kenya career resources","https://somkenjobs.com/career-resources","Use human-interest angle."
"Citizen Digital","https://www.citizen.digital/","Kenya","East Africa","media","","https://www.citizen.digital/contact-us","High reach; only pitch strong employment data or public-service guide.","Offer data from Somken Jobs if unique.","6","medium","not contacted","","","","no","East Africa hiring report","https://somkenjobs.com/career-resources","Do not pitch generic link."
"Tuko","https://www.tuko.co.ke/","Kenya","East Africa","media","","https://www.tuko.co.ke/contact-us/","Career and opportunities content may fit if useful to readers.","Pitch practical job seeker guide.","5","medium","not contacted","","","","no","Kenya career resources","https://somkenjobs.com/career-resources","Check editorial standards first."
"The EastAfrican","https://www.theeastafrican.co.ke/","Kenya","East Africa","media","","https://www.theeastafrican.co.ke/tea/page/contact-us-3921930","Regional publication aligns with East Africa labor market analysis.","Pitch East Africa humanitarian hiring trends.","7","medium","not contacted","","","","no","East Africa hiring report","https://somkenjobs.com/career-resources","Data-led outreach."
"Hiiraan Online","https://www.hiiraan.com/","Somalia","Horn of Africa","media","","https://www.hiiraan.com/contact.aspx","Somali diaspora and local readers may value career resources.","Pitch Somalia career or job scam safety guide.","7","medium","not contacted","","","","no","Somalia jobs resource","https://somkenjobs.com/jobs","Somali audience fit."
"Garowe Online","https://www.garoweonline.com/","Somalia","Horn of Africa","media","","https://www.garoweonline.com/en/contact-us","Somalia news readers may value public-service and NGO job resources.","Pitch Somali jobs and youth employment resource.","7","medium","not contacted","","","","no","Somalia jobs resource","https://somkenjobs.com/jobs","Media template."
"Somali Guardian","https://somaliguardian.com/","Somalia","Horn of Africa","media","","https://somaliguardian.com/contact-us/","Somalia-focused audience aligns with career and public-service resources.","Pitch data/resource story.","6","medium","not contacted","","","","no","Somalia career resources","https://somkenjobs.com/career-resources","Verify editorial contact."
"Radio Dalsan","https://www.radiodalsan.com/","Somalia","Horn of Africa","media","","https://www.radiodalsan.com/contact-us/","Somalia audience may benefit from job scam safety or youth jobs guide.","Pitch public-service career resource.","6","medium","not contacted","","","","no","Somalia jobs resource","https://somkenjobs.com/jobs","Good public-service angle."
"Goobjoog News","https://goobjoog.com/","Somalia","Horn of Africa","media","","https://goobjoog.com/contact-us/","Somalia news audience may value verified job resources.","Pitch job safety or career guide.","6","medium","not contacted","","","","no","Somalia career resources","https://somkenjobs.com/career-resources","Verify contact."
"Horseed Media","https://horseedmedia.net/","Somalia","Horn of Africa","media","","https://horseedmedia.net/contact-us/","Somali readers may use career resources and public-service directories.","Pitch useful Somalia jobs guide.","6","medium","not contacted","","","","no","Somalia jobs resource","https://somkenjobs.com/jobs","Media template."
"Kenya NGO Coordination Board","https://ngobureau.go.ke/","Kenya","East Africa","government/public resource","","https://ngobureau.go.ke/contact-us/","Registered NGO ecosystem overlaps with NGO job seekers and employers.","Ask if career/resource guide is suitable for external resources.","7","medium","not contacted","","","","no","Kenya NGO career resources","https://somkenjobs.com/career-resources","Government resource outreach; be conservative."
"Kenya Public Service Commission","https://www.publicservice.go.ke/","Kenya","East Africa","government/public resource","","https://www.publicservice.go.ke/contact-us/","Public-service job seekers may use complementary career resources.","Only pitch public-service career guide if clearly useful.","6","medium","not contacted","","","","no","Kenya public-service career resources","https://somkenjobs.com/career-resources","May not link; keep low-pressure."
"Kenya Ministry of Labour and Social Protection","https://labour.go.ke/","Kenya","East Africa","government/public resource","","https://labour.go.ke/contact-us/","Labor market and job safety content may support public awareness.","Pitch job scam verification guide.","6","medium","not contacted","","","","no","Job scam safety guide","https://somkenjobs.com/career-resources","Best after publishing safety guide."
"Ajira Digital","https://ajiradigital.go.ke/","Kenya","East Africa","government/public resource","","https://ajiradigital.go.ke/contact-us","Youth and digital jobs program aligns with career resources.","Share East Africa verified jobs and remote work guides.","7","medium","not contacted","","","","no","Remote jobs guide","https://somkenjobs.com/career-resources","Good youth employment fit."
"Somalia Ministry of Labour and Social Affairs","https://molgov.so/","Somalia","Horn of Africa","government/public resource","","https://molgov.so/contact/","Public labor agency audience overlaps with job seekers.","Offer public-service job safety or verified opportunity guide.","7","medium","not contacted","","","","no","Somalia job seeker resources","https://somkenjobs.com/career-resources","Verify current official contact."
"Somalia Ministry of Planning","https://mop.gov.so/","Somalia","Horn of Africa","government/public resource","","https://mop.gov.so/contact/","Development and public-resource audience overlaps with NGO careers.","Pitch public-service and NGO career resource.","6","medium","not contacted","","","","no","Somalia NGO career resources","https://somkenjobs.com/career-resources","Best with strong resource page."
"National Communications Authority Somalia","https://nca.gov.so/","Somalia","Horn of Africa","government/public resource","","https://nca.gov.so/contact/","ICT sector professionals may value verified opportunities.","Pitch ICT/professional opportunities resource.","6","medium","not contacted","","","","no","Somalia professional jobs","https://somkenjobs.com/jobs","Only if ICT resource exists."
"ACRED Somalia","https://acred.org/","Somalia","Horn of Africa","NGO","","https://acred.org/contact-us/","Local NGO audience aligns with Somalia jobs and public-service resources.","Ask to review resource and consider listing for beneficiaries/partners.","7","medium","not contacted","","","","no","Somalia NGO jobs","https://somkenjobs.com/jobs","Local NGO outreach."
"SASMO Somalia","https://sasmosomalia.org/","Somalia","Horn of Africa","NGO","","https://sasmosomalia.org/contact/","Local NGO and rights-based audience may benefit from opportunities.","Share career resources for NGO and protection roles.","7","medium","not contacted","","","","no","Somalia NGO jobs","https://somkenjobs.com/jobs","Verify contact."
"Somali Emergency Aid","https://www.sea.org.so/","Somalia","Horn of Africa","NGO","","https://www.sea.org.so/contact-us/","Local NGO network may share verified job opportunities.","Ask if resource is useful for community and partners.","7","medium","not contacted","","","","no","Somalia NGO jobs","https://somkenjobs.com/jobs","Local NGO outreach."
"HURDO Somalia","https://hurdo.org/","Somalia","Horn of Africa","NGO","","https://hurdo.org/contact/","Women-led NGO audience aligns with development careers.","Pitch women-focused career resources.","7","medium","not contacted","","","","no","Women career resources","https://somkenjobs.com/career-resources","Good content fit."
"Somali Recovery and Resilience Initiative","https://sorrisom.org/","Somalia","Horn of Africa","NGO","info@sorrisom.org","https://sorrisom.org/","Development and resilience professionals overlap with Somken users.","Offer Somalia development jobs resource.","7","medium","not contacted","","","","no","Somalia development jobs","https://somkenjobs.com/jobs","Contact visible on homepage."
"Somali Relief and Development Society","https://sordes.ngo/","Somalia","Horn of Africa","NGO","","https://sordes.ngo/contact/","Local NGO audience may use career resources.","Ask for resource inclusion if useful.","6","medium","not contacted","","","","no","Somalia NGO jobs","https://somkenjobs.com/jobs","Verify activity."
"IIDA Women's Development Organisation","https://iida.so/","Somalia","Horn of Africa","NGO","","https://iida.so/contact/","Women and community development audience aligns with career resources.","Pitch women-focused career guide.","6","medium","not contacted","","","","no","Women career resources","https://somkenjobs.com/career-resources","Best after guide exists."
"Tadamun Social Society","https://tadamun.so/","Somalia","Horn of Africa","NGO","","https://tadamun.so/contact/","Local NGO with development programming and likely job seeker audience.","Share Somalia NGO career resource.","6","medium","not contacted","","","","no","Somalia NGO jobs","https://somkenjobs.com/jobs","Verify current official URL."
"American Chamber of Commerce Kenya","https://www.amcham.co.ke/","Kenya","East Africa","chamber of commerce","info@amcham.co.ke","https://www.amcham.co.ke/contact-us","Member businesses may need hiring resources.","Offer employer and professional jobs resource.","7","medium","not contacted","","","","no","East Africa jobs resource","https://somkenjobs.com/jobs","Strong contact info."
"British Chamber of Commerce Kenya","https://bcckenya.org/","Kenya","East Africa","chamber of commerce","","https://bcckenya.org/contact-us/","Business members may benefit from talent and employer visibility resources.","Pitch employer resource for members.","6","medium","not contacted","","","","no","Kenya employer resources","https://somkenjobs.com/career-resources","Verify membership/resource policy."
"European Business Council Kenya","https://ebc-kenya.org/","Kenya","East Africa","business association","","https://ebc-kenya.org/contact/","International business network may value hiring and talent resources.","Offer Kenya/East Africa employer resource.","6","medium","not contacted","","","","no","East Africa jobs resource","https://somkenjobs.com/jobs","Business association template."
"Kenya Green Building Society","https://kgbs.co.ke/","Kenya","East Africa","professional association","","https://kgbs.co.ke/contact-us/","Built environment professionals align with construction career resources.","Pitch green building and construction careers guide.","7","medium","not contacted","","","","no","Construction career resources","https://somkenjobs.com/career-resources","Best after construction page exists."
"Institute of Quantity Surveyors of Kenya","https://iqskenya.org/","Kenya","East Africa","professional association","","https://iqskenya.org/contact-us/","Quantity surveyors align with construction jobs and resources.","Offer built-environment job resource.","7","medium","not contacted","","","","no","Construction jobs resource","https://somkenjobs.com/jobs","Verify contact."
"BORAQS Kenya","https://boraqs.or.ke/","Kenya","East Africa","professional regulator","","https://boraqs.or.ke/contact-us/","Architects and quantity surveyors may benefit from verified sector jobs.","Pitch construction/engineering careers resource.","7","medium","not contacted","","","","no","Construction career resources","https://somkenjobs.com/career-resources","Government/regulator caution."
"Association of Consulting Engineers of Kenya","https://acek.co.ke/","Kenya","East Africa","professional association","","https://acek.co.ke/contact-us/","Consulting engineers align with professional job and employer resources.","Offer engineering jobs guide for members.","7","medium","not contacted","","","","no","Engineering jobs resource","https://somkenjobs.com/jobs","Verify contact."
"Kenya Association of Private Employment Agencies","https://kapea.or.ke/","Kenya","East Africa","professional association","","https://kapea.or.ke/contact/","Employment agency association aligns with job market transparency.","Pitch job safety and verified employer resources.","7","medium","not contacted","","","","no","Verified job resource","https://somkenjobs.com/career-resources","Avoid link exchange language."
"Association of Kenya Suppliers","https://aks.co.ke/","Kenya","East Africa","business association","info@aks.co.ke","https://aks.co.ke/","Supplier network can use employer/resource visibility.","Pitch employer resource and business hiring guide.","6","medium","not contacted","","","","no","Kenya employer resources","https://somkenjobs.com/career-resources","Contact visible on homepage."
"Federation of African Engineering Organisations","https://faeo.org/","Africa","Africa","professional association","","https://faeo.org/contact/","Pan-African engineering network could value regional engineering resources.","Pitch engineering career resource after page is built.","6","medium","not contacted","","","","no","Engineering career resources","https://somkenjobs.com/career-resources","Regional association."
"Kenya Red Cross Society","https://www.redcross.or.ke/","Kenya","East Africa","NGO","","https://www.redcross.or.ke/contact-us/","Humanitarian professionals follow Red Cross and regional jobs.","Ask careers/comms team to review resource usefulness.","7","medium","not contacted","","","","no","Kenya humanitarian jobs","https://somkenjobs.com/jobs","Employer/resource angle."
"Amref Health Africa","https://amref.org/","Kenya","Africa","NGO","","https://amref.org/contact-us/","Health NGO professionals align with Somken job categories.","Share health and NGO job resource.","7","medium","not contacted","","","","no","East Africa health NGO jobs","https://somkenjobs.com/jobs","Best if health sector page exists."
"Act Change Transform Kenya","https://act.or.ke/","Kenya","East Africa","NGO","","https://act.or.ke/contact-us/","Civil society network may share NGO career resources.","Pitch NGO careers and verified job resource.","7","medium","not contacted","","","","no","Kenya NGO career resources","https://somkenjobs.com/career-resources","NGO resource template."
"Hivos East Africa","https://hivos.org/office/east-africa/","Kenya","East Africa","NGO","","https://hivos.org/contact/","Development and civic-tech audience overlaps with job seekers.","Share East Africa development jobs resource.","6","medium","not contacted","","","","no","East Africa development jobs","https://somkenjobs.com/jobs","Resource angle."
"Akili Dada","https://akilidada.org/","Kenya","East Africa","NGO","","https://akilidada.org/contact/","Young women leadership audience aligns with career resources.","Pitch women-focused career guide.","7","medium","not contacted","","","","no","Women career resources","https://somkenjobs.com/career-resources","Best after women-focused guide exists."
"Shining Hope for Communities","https://www.shofco.org/","Kenya","East Africa","NGO","","https://www.shofco.org/contact/","Community development audience may use job/career resources.","Offer NGO and public-service career resource.","6","medium","not contacted","","","","no","Kenya NGO jobs","https://somkenjobs.com/jobs","Verify contact."
"Mzalendo Trust","https://info.mzalendo.com/","Kenya","East Africa","civic platform","","https://info.mzalendo.com/contact/","Civic/public-service audience may value public-sector career guides.","Pitch public-service resource page.","6","medium","not contacted","","","","no","Kenya public-service career resources","https://somkenjobs.com/career-resources","Only after guide exists."
"Ushahidi","https://www.ushahidi.com/","Kenya","Africa","civic tech","","https://www.ushahidi.com/contact","Civic-tech and humanitarian tech community may value regional opportunities.","Pitch civic-tech and NGO job resource.","6","medium","not contacted","","","","no","East Africa civic-tech jobs","https://somkenjobs.com/jobs","Tech/civic angle."
"BRCK","https://www.brck.com/","Kenya","East Africa","technology company","","https://www.brck.com/contact/","Technology professionals and partners may value career resources.","Offer tech/professional jobs resource.","5","medium","not contacted","","","","no","East Africa tech jobs","https://somkenjobs.com/jobs","Company outreach only if natural."
"Africa's Talking","https://africastalking.com/","Kenya","Africa","technology company","","https://africastalking.com/contact","Developer ecosystem may benefit from regional tech jobs.","Pitch tech jobs/resource guide.","5","medium","not contacted","","","","no","East Africa tech jobs","https://somkenjobs.com/jobs","Potential low conversion."
"Sendy","https://www.sendyit.com/","Kenya","East Africa","technology/logistics company","","https://www.sendyit.com/contact","Employer profile or career resource angle if listed.","Ask to review listing if present; otherwise low priority.","5","medium","not contacted","","","","no","Somken Jobs","https://somkenjobs.com/jobs","Only if organization is listed."
"Twiga Foods","https://twiga.com/","Kenya","East Africa","company","","https://twiga.com/contact/","Large employer; possible listed organization outreach.","Ask to review organization listing if present.","5","medium","not contacted","","","","no","Somken Jobs","https://somkenjobs.com/jobs","Do not contact without listing/content fit."
"Wasoko","https://wasoko.com/","Kenya","Africa","company","","https://wasoko.com/contact/","Regional employer; possible job/resource connection.","Ask to review profile only if listed.","5","medium","not contacted","","","","no","Somken Jobs","https://somkenjobs.com/jobs","Company-listed outreach only."
"SafeBoda Kenya","https://www.safeboda.com/ke/","Kenya","East Africa","company","","https://www.safeboda.com/ke/contact","Potential employer profile if listed.","Ask to review listing if present.","5","medium","not contacted","","","","no","Somken Jobs","https://somkenjobs.com/jobs","Verify relevance first."
"Somali Jobs","https://somalijobs.com/","Somalia","Horn of Africa","job board","","https://somalijobs.com/contact","Relevant but competitor; link unlikely and not first-choice outreach.","Potential collaboration only if mutually useful and not excessive exchange.","4","low","not contacted","","","","no","Somken Jobs","https://somkenjobs.com/jobs","Avoid reciprocal link scheme."
"ReliefWeb","https://reliefweb.int/","Global","Global","humanitarian platform","","https://reliefweb.int/contact","Highly relevant source platform but unlikely to link to smaller aggregator.","Use for content citation, not normal outreach.","5","low","not contacted","","","","no","Somken Jobs","https://somkenjobs.com/jobs","Do not scrape outreach angle; respect terms."
"Devex","https://www.devex.com/","Global","Global","development platform","","https://www.devex.com/contact","Development careers audience overlaps but conversion unlikely.","Pitch data or source only if unique and editorially useful.","5","low","not contacted","","","","no","East Africa development jobs","https://somkenjobs.com/jobs","Avoid competitor link request."
"Idealist","https://www.idealist.org/","Global","Global","nonprofit job platform","","https://www.idealist.org/en/contact-us","Nonprofit careers audience overlaps but link unlikely.","Potential resource partnership only.","4","low","not contacted","","","","no","Somken Jobs","https://somkenjobs.com/jobs","Low priority competitor."
"UNjobs","https://unjobs.org/","Global","Global","job board","","https://unjobs.org/contact","Highly relevant but competitor/resource link unlikely.","No outreach unless there is a specific collaboration reason.","4","low","not contacted","","","","no","Somken Jobs","https://somkenjobs.com/jobs","Low priority."
"UN Volunteers","https://www.unv.org/","Global","Global","public service platform","","https://www.unv.org/contact-us","Volunteering and public-service audience overlaps with career resources.","Pitch volunteering/career guide if useful.","5","low","not contacted","","","","no","Public-service career resources","https://somkenjobs.com/career-resources","Global institutional target."
"FundsforNGOs","https://www2.fundsforngos.org/","Global","Global","NGO resource platform","","https://www2.fundsforngos.org/contact-us/","NGO audience may value career/resource guides.","Pitch useful NGO hiring resource, not link request.","5","low","not contacted","","","","no","NGO career resources","https://somkenjobs.com/career-resources","Check paid placement risk; avoid paid offers."
"Opportunity Desk","https://opportunitydesk.org/","Global","Global","opportunity platform","","https://opportunitydesk.org/contact-us/","Audience seeks jobs, fellowships, and opportunities.","Submit only if editorially appropriate and free.","5","low","not contacted","","","","no","East Africa opportunities","https://somkenjobs.com/jobs","Avoid paid submissions."
