"website_name","url","country","region","category","contact_email","contact_page","reason_to_link","outreach_angle","quality_score_1_10","priority","status","contact_date","follow_up_date","response","link_acquired","anchor_text","target_page","notes"
"African Business","https://african.business/","Africa","Africa","media","","https://african.business/contact","Business audience may value labor market data.","Pitch annual hiring trends only when data is strong.","5","low","not contacted","","","","no","East Africa hiring report","https://somkenjobs.com/career-resources","Media pitch later."
"How We Made It In Africa","https://www.howwemadeitinafrica.com/","Africa","Africa","media","","https://www.howwemadeitinafrica.com/contact/","Entrepreneurship readers may value employer/talent data.","Pitch regional hiring insights when available.","5","low","not contacted","","","","no","East Africa hiring report","https://somkenjobs.com/career-resources","Later-stage outreach."
"Pan African Chamber of Commerce and Industry","https://pacci.org/","Africa","Africa","business association","","https://pacci.org/contact-us/","Pan-African business network may use employer/resource pages.","Pitch employer resource after stronger content exists.","5","low","not contacted","","","","no","African employer resources","https://somkenjobs.com/career-resources","Lower immediate relevance."
"COMESA Business Council","https://comesabusinesscouncil.org/","Zambia","Africa","business association","","https://comesabusinesscouncil.org/contact-us/","Regional business body may value workforce resources.","Pitch regional employer resource only after content depth improves.","5","low","not contacted","","","","no","East Africa employer resources","https://somkenjobs.com/career-resources","Later-stage prospect."
"African Union Youth Program","https://au.int/en/youth-development","Africa","Africa","public resource","","https://au.int/en/contact","Youth employment audience overlaps with career resources.","Pitch youth employment guide if relevant.","5","low","not contacted","","","","no","Youth career resources","https://somkenjobs.com/career-resources","High bar for inclusion."
"UNDP Somalia","https://www.undp.org/somalia","Somalia","Horn of Africa","UN agency","","https://www.undp.org/somalia/contact-us","Public development audience overlaps with jobs and resources.","Only pitch if resource supports local capacity/careers.","5","low","not contacted","","","","no","Somalia development jobs","https://somkenjobs.com/jobs","Institutional link unlikely."
"UNDP Kenya","https://www.undp.org/kenya","Kenya","East Africa","UN agency","","https://www.undp.org/kenya/contact-us","Development professionals may value job resources.","Pitch career guide only if useful.","5","low","not contacted","","","","no","Kenya development jobs","https://somkenjobs.com/jobs","Institutional link unlikely."
"UNICEF Somalia","https://www.unicef.org/somalia/","Somalia","Horn of Africa","UN agency","","https://www.unicef.org/somalia/contact-us","Large employer and public-service audience.","Ask to review listings only if current jobs are shown.","5","low","not contacted","","","","no","UNICEF Somalia jobs","https://somkenjobs.com/jobs","Avoid generic link request."
"UNICEF Kenya","https://www.unicef.org/kenya/","Kenya","East Africa","UN agency","","https://www.unicef.org/kenya/contact-us","Large employer and public-service audience.","Potential employer listing review only.","5","low","not contacted","","","","no","UNICEF Kenya jobs","https://somkenjobs.com/jobs","Low conversion."
"WFP Somalia","https://www.wfp.org/countries/somalia","Somalia","Horn of Africa","UN agency","","https://www.wfp.org/contact","Humanitarian professionals overlap with Somken Jobs.","Employer listing review only if current jobs exist.","5","low","not contacted","","","","no","Somalia humanitarian jobs","https://somkenjobs.com/jobs","Institutional link unlikely."
"WFP Kenya","https://www.wfp.org/countries/kenya","Kenya","East Africa","UN agency","","https://www.wfp.org/contact","Humanitarian audience overlaps with Somken Jobs.","Employer listing/resource angle only.","5","low","not contacted","","","","no","Kenya humanitarian jobs","https://somkenjobs.com/jobs","Institutional link unlikely."
"Association of African Universities","https://www.aau.org/","Africa","Africa","education network","","https://www.aau.org/contact-us/","University network may value graduate career resources.","Pitch African graduate career resource after page exists.","5","low","not contacted","","","","no","Graduate career resources","https://somkenjobs.com/career-resources","Broad regional target."
"African Leadership Academy","https://www.africanleadershipacademy.org/","South Africa","Africa","education","","https://www.africanleadershipacademy.org/contact/","Youth leadership audience may value career resources.","Pitch East Africa career resources selectively.","4","low","not contacted","","","","no","Youth career resources","https://somkenjobs.com/career-resources","Lower geographic fit."
"African Leadership University","https://www.alueducation.com/","Rwanda","Africa","university","","https://www.alueducation.com/contact-us/","Students and alumni may value Africa-wide job resources.","Pitch East Africa professional opportunities if relevant.","5","low","not contacted","","","","no","East Africa jobs resource","https://somkenjobs.com/jobs","Later-stage education target."
"Ashesi University Career Services","https://www.ashesi.edu.gh/","Ghana","Africa","university","","https://www.ashesi.edu.gh/contact-us.html","High-quality university but outside initial geography.","Pitch only if Africa-wide resource exists.","4","low","not contacted","","","","no","Africa career resources","https://somkenjobs.com/career-resources","Lower priority."
"African Management Institute","https://www.africanmanagers.org/","Kenya","Africa","professional training","","https://www.africanmanagers.org/contact-us/","Professionals and entrepreneurs may value hiring resources.","Pitch manager/employer resource if useful.","5","low","not contacted","","","","no","East Africa career resources","https://somkenjobs.com/career-resources","Potential partnership."
"ALX Africa","https://www.alxafrica.com/","Africa","Africa","training provider","","https://www.alxafrica.com/contact/","Learners need job and career resources across Africa.","Pitch verified job resources after tech/career content exists.","5","low","not contacted","","","","no","East Africa tech jobs","https://somkenjobs.com/jobs","Large platform; low conversion."
"Andela","https://www.andela.com/","Global","Africa","talent platform","","https://www.andela.com/contact/","Talent platform overlaps with professional opportunities.","Potential content collaboration only.","4","low","not contacted","","","","no","East Africa tech jobs","https://somkenjobs.com/jobs","Not a natural early link target."
"Digital Opportunity Trust Kenya","https://www.dotrust.org/","Kenya","East Africa","youth employment NGO","","https://www.dotrust.org/contact/","Youth digital jobs mission aligns with career resources.","Share youth career guide.","6","low","not contacted","","","","no","Youth career resources","https://somkenjobs.com/career-resources","Validate Kenya-specific contact."
"AIESEC Kenya","https://aiesec.or.ke/","Kenya","East Africa","student organization","","https://aiesec.or.ke/contact/","Student and youth opportunities audience aligns with internships and jobs.","Pitch graduate/internship resources.","6","low","not contacted","","","","no","Graduate career resources","https://somkenjobs.com/career-resources","Good if active."
"Enactus Kenya","https://enactuskenya.org/","Kenya","East Africa","student entrepreneurship","","https://enactuskenya.org/contact/","Student entrepreneurs may value career and professional resources.","Offer youth career resources.","5","low","not contacted","","","","no","Youth career resources","https://somkenjobs.com/career-resources","Verify activity."
"Somaliland Youth Development Association","https://soyda.org/","Somaliland","Horn of Africa","youth NGO","","https://soyda.org/contact/","Youth employment and development audience aligns with Somken Jobs.","Pitch Somaliland/Somalia youth career resource.","6","low","not contacted","","","","no","Somalia youth jobs","https://somkenjobs.com/career-resources","Verify official site."
"Somali Youth Development Network","https://soyden.org/","Somalia","Horn of Africa","youth NGO","","https://soyden.org/contact/","Youth development audience may use job resources.","Pitch youth employment guide.","6","low","not contacted","","","","no","Somalia youth jobs","https://somkenjobs.com/career-resources","Verify contact."
"Somali Women Development Centre","https://swdc.so/","Somalia","Horn of Africa","women NGO","","https://swdc.so/contact/","Women-focused NGO audience aligns with career resources.","Pitch women career guide.","6","low","not contacted","","","","no","Women career resources","https://somkenjobs.com/career-resources","Verify site/contact."
"Elman Peace","https://elmanpeace.org/","Somalia","Horn of Africa","NGO","","https://elmanpeace.org/contact/","Youth, peacebuilding, and development audience overlaps with job resources.","Share public-service and NGO career resource.","6","low","not contacted","","","","no","Somalia NGO jobs","https://somkenjobs.com/jobs","Potentially good but verify."
"Candlelight Somaliland","https://candlelightsom.org/","Somaliland","Horn of Africa","NGO","","https://candlelightsom.org/contact/","Local development audience may use job and resources.","Pitch Somaliland development career resource.","6","low","not contacted","","","","no","Somalia development jobs","https://somkenjobs.com/jobs","Verify contact."
"KAALO Aid and Development","https://kaalo.org/","Somalia","Horn of Africa","NGO","","https://kaalo.org/contact/","Local NGO and partners may value verified jobs.","Share Somalia NGO careers resource.","6","low","not contacted","","","","no","Somalia NGO jobs","https://somkenjobs.com/jobs","Verify site."
"Puntland Development Research Center","https://pdrcsomalia.org/","Somalia","Horn of Africa","research organization","","https://pdrcsomalia.org/contact/","Research and development audience aligns with public-service careers.","Pitch Puntland/Somalia career resource.","6","low","not contacted","","","","no","Somalia career resources","https://somkenjobs.com/career-resources","Good regional content fit."
"Rift Valley Institute","https://riftvalley.net/","Kenya","East Africa","research organization","","https://riftvalley.net/contact","Horn/East Africa research audience may value public-service resources.","Pitch data-driven employment resource.","5","low","not contacted","","","","no","East Africa career resources","https://somkenjobs.com/career-resources","Use only with strong resource."
"International Crisis Group Horn of Africa","https://www.crisisgroup.org/africa/horn-africa","Global","Horn of Africa","research organization","","https://www.crisisgroup.org/contact","Policy audience is relevant but link unlikely.","Only cite or pitch if publishing labor-market/policy resource.","4","low","not contacted","","","","no","Somalia public-service resources","https://somkenjobs.com/career-resources","Low outreach priority."
"Africa Portal","https://www.africaportal.org/","Africa","Africa","research platform","","https://www.africaportal.org/contact/","Research platform may reference data-rich public resources.","Pitch only research-grade hiring report.","5","low","not contacted","","","","no","East Africa hiring report","https://somkenjobs.com/career-resources","Later-stage only."
"Open Capital Advisors","https://opencapital.com/","Kenya","Africa","consulting company","","https://opencapital.com/contact/","Employer/talent and market insights overlap with career resources.","Potential employer profile review if listed.","4","low","not contacted","","","","no","Somken Jobs","https://somkenjobs.com/jobs","Do not contact unless natural fit."
"Dalberg Africa","https://dalberg.com/","Africa","Africa","consulting company","","https://dalberg.com/contact/","Development consulting employer; candidate audience relevant.","Employer profile review only if listed.","4","low","not contacted","","","","no","Development jobs","https://somkenjobs.com/jobs","Low conversion."
"Briter Bridges","https://briterbridges.com/","Africa","Africa","data platform","","https://briterbridges.com/contact/","Africa ecosystem data platform may value job market data.","Pitch data collaboration after publishing report.","5","low","not contacted","","","","no","East Africa hiring report","https://somkenjobs.com/career-resources","Data pitch only."
"African Tech Roundup","https://africantechroundup.com/","Africa","Africa","media","","https://africantechroundup.com/contact/","Tech audience may value startup hiring resources.","Pitch tech career resource if strong.","4","low","not contacted","","","","no","East Africa tech jobs","https://somkenjobs.com/jobs","Low priority."
"Techpoint Africa","https://techpoint.africa/","Nigeria","Africa","media","","https://techpoint.africa/contact-us/","African tech media may cover regional employment trends.","Pitch only data-driven East Africa story.","4","low","not contacted","","","","no","East Africa hiring report","https://somkenjobs.com/career-resources","Later-stage media."
"Innovation Village","https://innovation-village.com/","Uganda","East Africa","startup hub","","https://innovation-village.com/contact/","East Africa startup network may value opportunity resources.","Pitch East Africa startup jobs guide.","5","low","not contacted","","","","no","East Africa startup jobs","https://somkenjobs.com/jobs","Regional but outside first markets."
"Outbox Uganda","https://outbox.co.ug/","Uganda","East Africa","startup hub","","https://outbox.co.ug/contact/","Regional startup community may use career resources.","Pitch startup jobs resource later.","5","low","not contacted","","","","no","East Africa jobs resource","https://somkenjobs.com/jobs","Later expansion."
"BongoHive","https://bongohive.co.zm/","Zambia","Africa","startup hub","","https://bongohive.co.zm/contact/","African startup hub; lower geographic fit.","Potential Africa-wide startup jobs resource.","4","low","not contacted","","","","no","Africa startup jobs resource","https://somkenjobs.com/career-resources","Later-stage only."
"CcHUB","https://cchub.africa/","Nigeria","Africa","startup hub","","https://cchub.africa/contact/","Pan-African tech ecosystem may value talent resources.","Pitch Africa tech job resource only if content expands.","4","low","not contacted","","","","no","Africa tech jobs resource","https://somkenjobs.com/jobs","Low priority."
